{
  "$schema": "../schemas/primitive-release.schema.json",
  "schemaVersion": 1,
  "releaseId": "urn:agentic-delivery:primitive-release:0.1.0-draft.1",
  "version": "0.1.0-draft.1",
  "status": "draft",
  "architecture": {
    "id": "urn:agentic-delivery:architecture:authority",
    "version": "0.1.0-draft.1",
    "sourceCommit": "67d328b46d84ae599ebfe65ef550d156f689e112"
  },
  "sourceCommit": "e83b17112cd5b5f6f790bcd679d185d9ec367368",
  "contentSha256": null,
  "capabilityPolicyVersion": "0.1.0"
}
